<?xml version="1.0" encoding="UTF-8"?>
<guide xmlns="http://www.epam.com/musicGuide" xmlns:xsi="http://www.w3.org/2001/XMLSchema-instance"
       xsi:schemaLocation="http://www.epam.com/musicGuide guide.xsd">

    <artist id="1" name="Sixto Rodriguez">
        <album id="1" title="Cold Fact" genre="Soul">
            <track id="1" title="Sugar Man" duration="PT3M45S"/>
        </album>
    </artist>
    <artist id="2" name="David Bowie">
        <album id="2" title="Heroes" genre="Art Rock">
            <track id="2" title="Life on Mars" duration="PT3M45S"/>
            <track id="3" title="The Man Who Sold the World" duration="PT3M45S"/>
        </album>
        <album id="3" title="Eternal" genre="Doom metal">
            <track id="4" title="Chrono.Naut" duration="PT3M45S"/>
            <track id="5" title="Funeralopolis" duration="PT3M45S"/>
        </album>
    </artist>
    <artist id="3" name="Jimi Hendrix">
        <album id="4" title="Band of Gypsys" genre="Rock">
            <track id="6" title="Who Knows" duration="PT3M45S"/>
            <track id="7" title=" Purple Haze" duration="PT5M45S"/>
        </album>
        <album id="5" title="Eternal" genre="Doom metal">
            <track id="8" title="Chrono.Naut" duration="PT3M45S"/>
            <track id="9" title="Funeralopolis" duration="PT3M45S"/>
        </album>
    </artist>

</guide>